{
  "type": "entity",
  "id": "request.delivery",
  "category": "evidence",
  "kind": "fulfillment_request",
  "label": "发货申请",
  "contextRef": "context.product-procurement",
  "responsibleRoleRef": "role.buyer",
  "attributes": [
    {
      "name": "started_at",
      "label": "发货申请时间",
      "valueType": "timestamp",
      "required": true,
      "keyData": true,
      "meaning": "客户提出发货申请的业务时间"
    },
    {
      "name": "expired_at",
      "label": "发货截止时间",
      "valueType": "timestamp",
      "required": true,
      "keyData": true,
      "meaning": "供应商完成发货的业务截止时间"
    },
    {
      "name": "delivery_address",
      "label": "收货地址",
      "valueType": "string",
      "required": true,
      "keyData": true,
      "meaning": "本次商品交付的地址"
    },
    {
      "name": "request_number",
      "label": "发货申请编号",
      "valueType": "string",
      "required": true,
      "keyData": true,
      "meaning": "本次发货申请的业务标识；补充证据与确认引用同一申请编号"
    }
  ],
  "fulfillmentRef": "fulfillment.delivery"
}
