{
  "type": "entity",
  "id": "rfp.content-topic",
  "category": "evidence",
  "kind": "rfp",
  "label": "内容产品选题请求",
  "contextRef": "context.content-production-precontract",
  "responsibleRoleRef": "role.platform-content-production",
  "attributes": [
    {
      "name": "started_at",
      "label": "发出时间",
      "valueType": "timestamp",
      "required": true,
      "keyData": true,
      "meaning": "合成测试明确记录的发出时间"
    },
    {
      "name": "expired_at",
      "label": "有效期截止时间",
      "valueType": "timestamp",
      "required": true,
      "keyData": true,
      "meaning": "合成测试明确记录的有效期截止时间"
    }
  ]
}
